"c_vaccine_detail_id","c_vaccine_id","c_pathogen_id","c_type","c_antigen","c_model_host","c_vector","c_allergen","c_description","c_preparation","c_virulence","c_full_text","c_curation_flag","c_contraindication"
14,14,7,Rabies virus glycoprotein as a carrier for anthrax protective antigen,,,"",,"Rabies virus (RV) envelope glycoprotein (RVG) is used as a carrier molecule to present Bacillus anthracis protective antigen (PA) domain-4 in the viral membrane. The chimeric RV G anthrax PA on the cell surface is also efficiently incorporated into RV virions. Mice immunized with the inactivated recombinant RV virions exhibit seroconversion against both RV G and anthrax PA [Ref17:Smith et al., 2006].","pGEM PA63 contains the sequence encoding the Newcastle disease virus (NDV) transmembrane (TM) and cytoplasmic domain (CD) followed by the sequence encoding the translocation-deficient form of the 63-kDa fragment of B. anthracis PA. The PA63 gene was optimized for human codon usage to ensure high expression levels. All sequences were synthesized by non-template PCR and inserted into the pGEM-T vector at the XbaI site. To construct the recombinant RV expressing D4-E51, pD4-E51 and pSPBN were digested with BsiWI and NheI and the D4-51 fragment ligated to pSPBN, resulting in pSPBN-D4-E51 [Ref17: Smith et al., 2006].","[Ref17:Smith et al., 2006]",,11,
15,15,7,Subunit vaccine,A cell-free filtrate of B. anthracis culture,,"",,"AVA is the only licensed human anthrax vaccine in the United States. This vaccine was developed in the early 1950s and was licensed by the FDA in 1970.  AVA has been shown to have a 92.5% efficacy for protection in both cutaneous and inhalational anthrax cases  [Ref19: Brey, 2005].","This vaccine is prepared by adsorbing filtered culture supernatants of an attenuated strain (V770-NP1-R) to aluminum hydroxide (Alhydrogel) as an adjuvant [Ref19: Brey, 2005]. The strain V770-NP1-R used for AVA preparation is a toxigenic, nonencapsulated strain.  The filtrate contains a mix of cellular products including all three toxin components (LF, EF, and PA)  (Amphogel, Wyeth Laboratories) [Ref18:CDC, 2000].","Most studies show that AVA only induces localized, minor, and self-limited adverse effects. No studies have definitively documented any occurrence of chronic diseases (e.g. cancer or infertility) following anthrax vaccination [Ref18:CDC, 2000].                                                                                                                                                                     ",,10,"The use of BioThrax is contraindicated in subjects with a history of anaphylactic or anaphylactic-like reaction following a previous dose of BioThrax, or any of the vaccine components."
13,13,8,Live attenuated B. abortus strain,"",,"",,"","RB51WboA is a recombinant Brucella strain that complements RB51 with a functional wboA gene. Rough Brucella abortus RB51 is a stable, attenuated mutant vaccine generated strain derived from virulent strain 2308. The wboA gene in RB51 is disrupted by an IS711 element. Abrogation of the wboA gene in smooth , virulent B. abortus, B. melitensis , and B. suis results in rough , attenuated mutants which fail to produce O polysaccharide (O antigen) [Ref189:Vemulapalli et al., 2000].","RB51WboA is not more virulent than RB51  [Ref189:Vemulapalli et al., 2000b].",,10,
11,11,8,Live attenuated B. abortus strain,"",,"",,"RB51SOD is a recombinant strain of B. abortus cattle vaccine strain RB51. RB51SOD overexpresses B. abortus Cu/Zn superoxide dismutase (SOD). Overexpression of this enzyme significantly increases vaccine efficacy against strain 2308 challenge [Ref187:Vemulapalli et al., 2004].","The gene for B. abortus Cu/Zn SOD (sodC) along with its own promoter was initially obtained from a genomic library of B. abortus strain 2308, and later subcloned into pBBR1MCS, a broad-host-range plasmid. The resulting plasmid pBBSOD was transformed into E. coli DH5a, confirmed, purified, and then electroporated into B. abortus strain RB51. Strain RB51 containing the plasmid pBBSOD was designated RB51SOD [Ref14:Vemulapalli et al., 2000a].","RB51SOD is not more virulent than RB51 [Ref187:Vemulapalli et al., 2004].",,10,
10,10,8,Live attenuated B. abortus strain,"The antigen for this live attenuated vaccine is the whole cells of strain RB51.  This strain has rough characteristics and is devoid of O-chain. The RB51 was derived from the virulent smooth B. abortus 2308 by several passages in media supplemented with sub-inhibitory concentrations of rifampicin [Ref12:Schurig et al., 1991].",,"",,"RB51 has been the official cattle Brucella vaccine in the USA since 1996 and now in many other countries [Ref11:Schurig et al., 2002]. RB51 is a rifampin-resistant rough attenuated mutant of Brucella abortus derived by repeated passage of strain 2308 on Trypticase soy supplemented with 1.5% agar and varying concentrations rifampin or penicillin.  Rabbits, goats and cattle hyperimmunized with sonicates of RB51 develop antibodies to B. abortus cellular antigens but do not develop specific antibodies for the Brucella O-chain [Ref12:Schurig et al., 1991].","","RB51 is a rough attenuated strain [Ref12:Schurig et al., 1991].                       ",,10,
114,114,24,"Inactivated or ""killed"" vaccine",inactivated whole-cell Campylobacter jejuni (CWC),,"",,"Whole-cell vaccine formulations deserve further evaluation as candidate vaccines and the potential value of mucosal adjuvants, like LT, in enteric vaccine development are not in doubt [Ref205:Baqar et al., 1995].","The CWC vaccine is prepared from the 81-176 strain of C. jejuni and consists of a 1:1 mixture of heat (60 C, 60 min)- and formalin (0.02 M)-inactivated Campylobacter whole cells. Each vaccination group receives oral doses of CWC vaccine containing bacterial cells alone or in combination with 25 mg of LT. Just prior to vaccination, gastric acidity is neutralized by 2 doses of a 5% NaHCO3 solution (pH 8.5) with a 15-min interval [Ref205:Baqar et al., 1995b].","Volunteers given the CWC vaccine have similar IgA-ASC and sIgA responses and in vitro induction of IFN to Campylobacter antigens [Ref583:Walker, 2005].",,10,
17,17,7,"Live, attenuated vaccine","",,"",,"","Anthrax Spore Vaccine is prepared with a relatively nonpathogenic, noncapsulated variant strain of B. anthracis, originally developed at the Onderstepoort Laboratory, Pretoria, South Africa. Further work was conducted in England, India and in many other countries. Vaccine Strain is Sterne 34F2. The vaccine is a suspension of viable Bacillus anthracis spores in saponin [Ref878:Spore vaccine].","",,10,
437,437,29,"Live, attenuated vaccine","",,,,"","In order to generate a live vaccine that provides improved protection against M. tuberculosis, BCG was equipped with the membrane-perforating Hly of L. monocytogenes (hly+ rBCG). To improve the pH milieu for Hly activity, a Î”ureC hly+ rBCG strain that lacked ureC activity was constructed [Ref856:Grode et al., 2005].","",,10,""
20,20,7,Subunit vaccine,PA domain 4 from B. anthracis strain Sterne,,"",,"Domain 4 contains the dominant protective epitopes of PA and comprises amino acids 596-735 of the carboxy terminus of the PA polypeptide.  Cell intoxication is thought to occur when full-length PA (PA83) binds to the cell surface receptor via domain 4, which contains the host cell receptor binding site.  After binding to the host cell receptor, the N-terminal amino acids (1-167, i.e. domain 1a) of domain 1, which contains a furin protease cleavage site, are cleaved off, exposing the LF or EF binding site located in domain 1b and the adjacent domain 3.  Domains 2 and 3 then form part of a heptameric pore on the cell surface, the LF or EF binds to its receptor, and the whole toxin complex undergoes receptor-mediated endocytosis into the cell.  After acidification of the endosome, the toxin is translocates into the cell cytosol, where it exerts its cytotoxic effect.  Therefore, inhibition of the binding and entry of the toxin complex, particularly lethal toxin, into the host cell is clearly important for the prevention of infection.  The crystal structure of PA shows domain 4 to be more exposed than the other three domains, which are closely associated with each other.  This structural arrangement may make the epitopes in domain 4 the most prominent for recognition by immune effector cells [Ref21:Flick-Smith et al., 2002].","DNA encoding the PA domains, which comprise amino acids 1-258, 168-487, 1-487, 168-595, 1-595, 259-735, 488-735, 596-735, and 1-735 (fusion proteins GST1, GST1b-2, GST1-2, GST1b-3, GST1-3, GST2-4, GST3-4, GST4, and GST1-4, respectively), was PCR amplified from B. anthracis strain Sterne DNA and cloned into the XhoI and BamHI sites of the expression vector pGEX-6-P3.  Proteins produced by this system were expressed as fusion proteins with an N-terminal glutathione S-transferase (GST) protein.  Immunization was done with rPA, with recombinant GST control protein, or with fusion proteins comprising domains 1, 4, and 1 to 4, which had the GST tag removed by incubation with PreScission Protease and removal of the GST on a glutathione Sepharose column [Ref21: Flick-Smith et al., 2002].","[Ref21:Flick-Smith et al., 2002]",,10,
21,21,7,Subunit vaccine,"",,"",,"Protective antigen (PA) is the dominant antigen in both natural and vaccine-induced immunity to anthrax infection and consists of four distinct and functionally independent domains.  One ot them is domain 1, which is divided into domains 1a, consisting of amino acids 1 to 167, and 1b, consisting of amino acids 168 to 258.  After the antigen binds to the host cell receptor via the binding site of domain 4, the N-terminal amino acids (1 to 167, i.e. domain 1a) of domain 1, which contains a furin protease cleavage site, are cleaved off, exposing the LF or EF binding site located in domain 1b and the adjacent domain 3 [Ref21:Flick-Smith et al., 2002].","DNA encoding the PA domains (amino acids 1-258, 168-487, 1-487, 168-595, 1-595, 259-735, 488-735, 596-735, and 1-735; fusion proteins GST1, GST1b-2, GST1-2, GST1b-3, GST1-3, GST2-4, GST3-4, GST4, and GST1-4, respectively) was PCR amplified from B. anthracis strain Sterne DNA and cloned into the XhoI and BamHI sites of the expression vector pGEX-6-P3.  Proteins produced by this system were expressed as fusion proteins with an N-terminal glutathione S-transferase (GST) protein.  Immunization was done with rPA, with recombinant GST control protein, or with fusion proteins comprising domains 1, 4, and 1-4, which had the GST tag removed by incubation with PreScission Protease and removal of the GST on a glutathione Sepharose column [Ref21: Flick-Smith et al., 2002].","[Ref21:Flick-Smith et al., 2002]",,11,
22,22,7,Subunit vaccine,PA domain 1-3 from B. anthracis strain Sterne.,,"",,"","DNA encoding the PA domains (fusion proteins GST1, GST1b-2, GST1-2, GST1b-3, GST1-3, GST2-4, GST3-4, GST4, and GST1-4), was PCR amplified from B. anthracis strain Sterne DNA and cloned into the XhoI and BamHI sites of the expression vector pGEX-6-P3.  Proteins produced by this system were expressed as fusion proteins with an N-terminal glutathione S-transferase (GST) protein.  Immunization was done with rPA, with recombinant GST control protein, or with fusion proteins comprising domains 1, 4, and 1-4, which had the GST tag removed by incubation with PreScission Protease and removal of the GST on a glutathione Sepharose column [Ref21: Flick-Smith et al., 2002].","[Ref21:Flick-Smith et al., 2002]",,11,
31,31,11,"Inactivated or ""killed"" vaccine",,,"",,"The earliest report of a killed whole cell vaccine against plague was in 1897, developed by HalIkine in India. The vaccine caused severe side-effects and was discontinued, although the HalTkine Institute now produces a formaldehyde-killed preparation of strain 195/P [Ref72:Russell et al., 1995]. It was not until 1946 that a killed whole cells vaccine was developed for use in man. Various methods of killing the bacterial cells have been used, including formaldehyde and heat treatment. The vaccine is currently produced by the Commonwealth Serum Laboratories in Australia and is usually given as a course of three doses over a period of two months[Ref53:Titball et al., 2001]. The vaccine currently used in the USA and in the UK is the Plague vaccine, USP (Cutter Biological), a formaldehyde-killed preparation of the highly virulent 195/P strain of Y pestis [Ref72:Russell et al., 1995].There are no definitive clinical trials which demonstrate the efficacy of killed whole cell vaccines. However, studies in several animal species have demonstrated protection against bubonic plague. Also there is circumstantial evidence for the efficacy of the vaccine in humans derived from data on the incidence of bubonic plague in immunised US servicemen serving in Vietnam during the period 1961â€“1971. It is possible that differences in the lifestyles of servicemen and Vietnamese civilians were responsible for the reduced incidence of plague in the former group. Evidence for the efficacy of killed whole cells vaccines for the prevention of pneumonic plague is less conclusive. Cases of pneumonic plague have been reported in individuals immunised with this vaccine. More recently it has been shown that mice immunised with this vaccine are protected against subcutaneous challenge, but not against inhalation challenge with Y. pestis. Together, these findings suggest that killed whole cell vaccines do not induce a response which provides protection against pneumonic plague [Ref53:Titball et al., 2001]. Additional problems of the vaccine include the following: production requires special containment; the vaccine is expensive; protection is short-term and annual boosters are required; the incidence of side-effects is high, local reactions occur in 11-24% of vaccinees and systemic effects occur in 4-10% of vaccinees [Ref72:Russell et al., 1995].","USP consists of an aqueous suspension of virulent P.pestis grown on agar medium in Roux bottles.  The organisms are harvested in physiological saline and killed by adding formol to an overall concentration of 0.5 %.  The standardized suspension is supplied in 20 ml vaccine vials, each ml containing 2*10^9 bacilli [Ref104:Meyer, 1970].  ","Side effects, such as malaise, headaches elevated temperature and lymphadenopathy occur in approximately 10% of those immunised with killed whole cells vaccines [Ref53:Titball et al., 2001].                                                                                                                                                            ",,10,
32,32,11,Live attenuated ,,,"",,"A live, attenuated vaccine has also been used since 1908 using the avirulent strain of Y pestis, EV76. This strain is not capable of assimilating chromatophores such as Congo Red or haemin from artificial media, and is described as Pigmentation (Pgm) -. Virulent strains of Y. pestis are Pgm+. Although the organisms in the vaccine could multiply following administration, and could therefore theoretically enhance protection, there appeared to be wide variation in the immunogenicity and virulence between different EV76 vaccine preparations. The vaccine caused severe side-effects when used and there was also the danger of reversion to a fully virulent form. A large part of the Vietnamese population was vaccinated with EV76 between 1967 and 1969 [Ref72:Russell et al., 1995].","The EV76 strain is a pigmentation negative mutant of Y. pestis which was derived from a fully virulent strain. The vaccine has been in use since 1908 and is given as a single dose of 5.8Ã—10^6 cfu. Findings suggest that immunisation with the EV76 vaccine will provide protection against both bubonic and pneumonic plague in man. However, the safety of this vaccine in man is questionable, because the EV76 strain is not avirulent [Ref53:Titball et al., 2001].","A febrile response was reported in 20% of vaccinees, accompanied by headache, weakness, and malaise. Erythema surrounding the site of vaccination, reaching dimensions as large as 15 cm2, was frequently reported. Some severe systemic reactions even required hospitalization. Numerous unsuccessful attempts were made to reduce the incidence of side effects by administering the vaccine by different routes, such as scarification, inhalation, and even intraocularly [Ref61: Williamson et al., 2005].                                                                                                                                                                                ",,10,
33,33,11,live attenuated,,,"",,"Pla functions as a surface plasminogen activator protease. Pla is encoded on the pPst plasmid found in virulent strains of Y. pestis. It is a major virulence factor and has been proposed to facilitate the spread of the organisms from peripheral sites of infection. Strains cured of the pPst plasmid retained their virulence if inoculated by a direct route such as i.v., however, loss of pPst led to a million-fold increase in s.c. LD50 in mice. Consequently, pPst-cured or other Plaâˆ’ mutants are reasonable live vaccine candidates [Ref55:Welkos et al., 2002]. 
Protective efficacy has not yet been tested [Ref53:Titball et al., 2001].  However, a C092 Pgmâˆ’ Plaâˆ’ strain that is unable to produce Pla was shown to be significantly more attenuated than was the parental Pgmâˆ’ strain; all mice exposed s.c. to the highest dose tested of the double mutant (108 cfu) survived. To determine the effect of the additional mutation on the virulence of C092 Pgmâˆ’ for monkeys, four animals were exposed by the aerosol route to high doses of C092 Pgmâˆ’ Plaâˆ’. All four monkeys exposed to inhaled doses ranging from 3.5Ã—107 to 1.8Ã—108 cfu survived, and they showed only mild symptoms of infection [Ref55:Welkos et al., 2002].","",                                                                  ,,11,
34,34,11,Adhesin,,,"",,"The bacterial pathogen Yersinia pestis expresses a potential adhesin, the pH6 antigen (pH6-Ag), which appears as fimbria-like structures after exposure of the bacteria to low pH. pH6-Ag was previously shown to agglutinate erythrocytes and to bind to certain galactocerebrosides. Purified pH6-Ag selectively binds to apolipoprotein B (apoB)-containing lipoproteins in human plasma, mainly LDL. Binding was not prevented by antibodies to apoB. pH6-Ag interacted also with liposomes and with a lipid emulsion, indicating that the lipid moiety of the lipoprotein was responsible for the interaction. Both apoB-containing lipoproteins and liposomes prevented binding of pH6-Ag to THP-I monocyte-derived macrophages as well as pH6-Ag-mediated agglutination of erythrocytes. Binding of pH6-Ag to macrophages was not dependent on the presence of LDL receptors. Treatment of the cells with Triton X-100 or with methyl-beta-cyclodextrin indicated that the binding of pH6-Ag was partly dependent on lipid rafts. Interaction of pH6-Ag with apoB-containing lipoproteins could be of importance for the establishment of Y. pestis infections. Binding of lipoproteins to the bacterial surface could prevent recognition of the pathogen by the host defence systems. This might be important for the ability of the pathogen to replicate in the susceptible host [Ref114:Makoveichuk et al., 2003].","",                                            ,,11,
23,23,7,Genetic vaccine (DNA plasmid),"B. anthracis PA [Ref25:Gu et al., 1999]",,"",,"There have been many attempts to improve the safety and immunogenicity of the current licensed anthrax vaccine, including the formulation of PA in different adjuvants, the use of recombinant, mutant PA, expression of PA by attenuated salmonellae, and the generation of attenuated B. anthracis strains lacking one or more toxin components. Current studies have examined the possibility of inducing protection against anthrax toxin by immunizing with a DNA vaccine encoding PA. Studies in other model systems indicate that antigen-encoding DNA plasmids can stimulate strong cellular and humoral immune responses against proteins from pathogens [Ref25:Gu et al., 1999].","The gene fragment encoding AAs 173â€“764 of PA was PCR amplified. The PCR product was digested with NheI and BamHI and ligated into the pJW4303 vector, which was cut with the same two restriction enzymes. Both PA plasmid and control DNA were purified from E. coli DH5a using Endo-free plasmid preparation kits (Qiagen) and resuspended in PBS before use [Ref25: Gu et al., 1999].","Virulent strains of B. anthracis are characterized by their expression of a polyglutamic acid capsule and the production of a protein toxin. In vivo studies to determine whether cell mediated immunity provided protection against virulent B. anthracis could not be performed, since such studies require BL3 con-tainment facilities [Ref25:Gu et al., 1999].",,10,
24,24,7,Conjugate vaccine,Two antigens: PA-B and capsular poly-Î³-d-glutamate. Both antigens are conjugated.,,"",,"Anthrax involves a dual process of bacterial replication and toxin production. The dually active anthrax vaccine (DAAV) confers simultaneous protection against both bacilli and toxins was highly sought after through research. The weakly immunogenic and antiphagocytic PGA capsule disguises the bacilli from immune surveillance in a similar manner to the role of capsular polysaccharides in protecting pathogens, such as pneumococci and meningococci. Encapsulated B. anthracis strains grow unimpeded in the infected host, whereas isolates lacking the capsule are phagocytized and are virtually avirulent. Anthrax toxins are formed by PA, lethal factor (LF), and edema factor (EF), which are secreted separately as nontoxic monomers. The binding of LF or EF to PA results in the formation of active lethal toxin (LT) or edema toxin (ET), respectively. Because of its ability to elicit a protective immune response against both anthrax toxins, PA is the target antigen of existing anthrax vaccine. However, a vaccine based on both PGA and PA might allow direct targeting of bacillar growth, as well as inhibiting toxin activity, making it more effective than a vaccine based on PA alone. PGA is an attractive antigen because it consists of d-glutamic acid residues linked by Î³ peptide bonds, and thus bears no resemblance to mammalian host molecules [Ref26: Rhie et al., 2003].","This conjugate vaccine is constructed by conjugating two major virulence factors of B. anthracis, the capsular poly-Î³-D-glutamic acid (PGA) and the essential toxin component and protective antigen (PA). This is a DAAV that confers simultaneous protection against both bacilli and toxins. Two sets of conjugates with 1:2 and 1:1 (wt/wt) PGA-to-PA ratios, designated DAAV-1 and DAAV-2, respectively [Ref26:Rhie et al., 2003].","[Ref26:Rhie et al., 2003]",,10,
25,25,7,Conjugate vaccine,,,"",,"Both the protective antigen (PA) and the poly(Î³-d-glutamic acid) capsule (Î³dPGA) are essential for the virulence of Bacillus anthracis. A critical level of vaccine-induced IgG anti-PA confers immunity to anthrax, but there is no information about the protective action of IgG anti-Î³dPGA. Î³dPGA is a surface structure, inhibits in vitro phagocytosis and, when injected, is a poor immunogen even as a bacterial component; the protective effect of anti-Î³dPGA has not been reported. The capsule shields the vegetative form of B. anthracis from agglutination by monoclonal antibodies to its cell wall polysaccharide. Systemic infection with B. anthracis induces Î³dPGA antibodies. Antibodies to d-amino acid polymers may be induced in animals by injection of Î³dPGA methylated BSA complexes along with Freund's adjuvant, i.v. injections of a formalin-treated capsulated B. anthracis, or by peptidyl proteins [Ref30:Schneerson et al., 2003].","All eight conjugates were precipitated with an identity reaction with their protein and Î³PGA antisera by immunodiffusion [Ref30: Schneerson et al., 2003].","[Ref30:Schneerson et al., 2003]",,11,
