"c_vaccine_detail_id","c_vaccine_id","c_pathogen_id","c_type","c_antigen","c_model_host","c_vector","c_allergen","c_description","c_preparation","c_virulence","c_full_text","c_curation_flag","c_contraindication"
304,304,8,"Live, attenuated vaccine","An attenuated mutant of Brucella meletensis called vjbR::Tn5 (BMEII1116) is the antigen used in this vaccine [Ref699:Arenas-Gamboa et al., 2008].",,"",,"","6 x 10^6 CFU of the live  B. melitensis mutant bjvR::Tn5 was suspended in 1ml of MOPS buffer (buffer containing MOPS and NaCl) and mixed with 5 ml of alginate solution. Spheres were obtained by extruding the suspension through a 200 micron nozzle into a 100 mM calcium chloride solution and stirred for 15 minutes. After extrusion of the bacteria-alginate mixture into the CaCl2, the capsules were washed twice with MOPS for 5 minutes and further crosslinked with 0.05% poly-L-lysine for 10 minutes.  Following two successive washes, the beads were stirred for five minutes in a solution of 0.03% (w/v) alginate to apply a final outer shell and washed twice with MOPS [Ref699:Arenas-Gamboa et al., 2008].",B. melitensis mutant bjvR::Tn5 is an attenuated live strain.,,10,
305,305,18,Subunit vaccine,"This vaccine uses the A27L and D8L proteins from the intracellular mature virus form and the B5R protein from the extracellular enveloped virus form of the vaccinia virus [Ref701:Berhanu et al., 2008].",,"",,"","Vaccines contained 10 micrograms of A27L, D8L, and B5R in 100 microliters of phosphate buffered saline mixed with 100 microliters of MPL-TDM [Ref701:Berhanu et al., 2008].","",,10,
306,306,8,"Live, attenuated vaccine","The antigens used for this vaccine were attenuated, purine auxotrophic B. melitensis WR201 bacteria [Ref702:Izadjoo et al., 2004].",,"",,"","The bacterial strain WR201 is created by the deletion of purEK from B. melitensis strain 16M. Stock was grown in brucella broth at 37Â°C. 3 to 4 ml of this broth culture was plated on dishes containing brucella agar, then after incubation the plates were harvested with saline. Brucella bacteria were pelleted, washed twice, and standardized to 5 Ã— 10^11 cells/ml. A total of 0.2 ml of this suspension was given to mice [Ref702:Izadjoo et al., 2004].","Strain WR201 bacteria are attenuated relative to strain 16M levels [Ref702:Izadjoo et al., 2004].",,11,
307,307,8,Subunit vaccine,"The antigens used in this vaccine were purified Brucella melitensis lipopolysaccharide (LPS) as a noncovalent complex with Neisseria meningitidis group B outer membrane protein (GBOMP) [Ref703:Bhattacharjee et al., 2002].",,"",,"","To create the vaccine, the LPS was extracted from killed B. melitensis cells and purified. N. meningitidis group B strain 8047 bacteria were grown in a synthetic medium, and outer membrane protein (GBOMP) was extracted. The B. melitensis LPS-GBOMP noncovalent complex vaccine was prepared with purified B. melitensis LPS dissolved in 42 ml of TEEN buffer. This mixture was added to the LPS solution and kept at 5Â°C for 30 min. The detergent was removed, and buffer was exchanged with sterile 0.9% NaCl solution. The final product was filtered and the LPS content was determined [Ref703:Bhattacharjee et al., 2002].","",,10,
308,308,8,"Live, attenuated vaccine","This vaccine is an live, attenuated purine-auxotrophic mutant strain of Brucella meletensis, WR201 [Ref704:Hoover et al., 1999].",,"",,"","The WR201 strain was procured and the bacterial cells were killed by treatment for 16 h with 0.5% phenol. These cells were then washed and pelleted several times, eventually leading to a product containing approximately 3.0 mg of protein per ml [Ref704:Hoover et al., 1999].","The antigens for this vaccine were severely attenuated. The strain WR201 fails to replicate in cultured human monocyte-derived macrophages [Ref704:Hoover et al., 1999].",,10,
310,310,26,Subunit vaccine,"HIV glycoprotein 120, which has a role in facilitating coreceptor interaction and in mediating virus binding to cellular CD4 [Ref707:Bielinska et al., 2008].",,"",,"","The gp120 and NE vaccines were prepared by mixing NE with gp120 protein solution, using pyrogen-free saline as a diluent [Ref707:Bielinska et al., 2008].","",,10,
311,311,18,"Inactivated or ""killed"" vaccine","Two strains of vaccinia virus (VV) were used for antigens: VV Western Reserve strain (VVWR) and recombinant Western Reserve strain (VVWR-Luc). The recombinant strain is the same as the VVWR except for expression of firefly luciferase from the pH 7.5 early/late promoter [Ref708:Bielinska et al., 2008].",,"",,"","The viruses killed by incubation were incubated for 3 h at 37Â°C in 10% NE. Nasal instillation killed virus was diluted to obtain either 1 x 10^3 PFU or 1 x 10^5 PFU per dose in 1% NE. Vaccine formulations containing formalin-killed virus (Fk) were prepared by incubation of VV (about 10^8 PFU/ml) with 0.1% formalin at room temperature for 3 h. This mixture was then diluted in either saline or 1% NE to 1 x 10^3 or 1 x 10^5 PFU per dose to reduce the formalin to nontoxic concentrations for intranasal (i.n.) immunization [Ref708:Bielinska et al., 2008].","",,10,
312,312,41,Toxoid vaccine,"",,,,It has been licensed for use in the USA.,"","",,11,
313,313,41,Toxoid vaccine,"",,,,"Tetanus Toxoid Adsorbed manufactured by Aventis Pasteur Inc., for intramuscular injection, is a sterile suspension of alum-precipitated (aluminum potassium sulfate) toxoid in an isotonic sodium chloride solution [Ref749:FDA: Tetanus Toxoid Adsorbed].","C. tetani culture is grown in a peptone-based medium containing an extract of bovine muscle tissue and detoxified with formaldehyde. The detoxified material is purified by serial ammonium sulfate fractionation and diafiltration, followed by sterile filtration. The toxoid is adsorbed to aluminum potassium sulfate (alum). The adsorbed toxoid is diluted with physiological saline solution (0.85%) [Ref749:FDA: Tetanus Toxoid Adsorbed by Sanofi Pasteur Inc].","",,10,"This vaccine should not be administered to anyone with a known hypersensitivity to any component of the vaccine, including thimerosal [Ref749:FDA: Tetanus Toxoid Adsorbed by Sanofi Pasteur Inc]"
314,314,41,Toxoid vaccine,"",,,"The stopper of the vial contains dry natural latex rubber, that may cause allergic reactions [Ref2076:FDA: Tetanus Toxoid].","Tetanus Toxoid is interchangeable with Tetanus Toxoid Adsorbed (contains aluminum adjuvant) as a booster, and would only be preferred if aluminum was to be avoided. Although the rate of seroconversion is essentially equivalent with either form, adsorbed toxoids induce more persistent antitoxin titers.2 Tetanus Toxoid would be preferred over diphtheria-containing vaccines if there was a contraindication to the diphtheria component [Ref2076:FDA: Tetanus Toxoid].","","",,11,
315,315,29,"Live, attenuated vaccine",Mycobax is a formulation of live attenuated strain of Mycobacterium bovis (Bacillus Calmette Guerin; BCG).,,,,"","","",,10,
316,316,46,"Live, attenuated vaccine","Meningococcal Polysaccharide Vaccine, Groups A, C, Y and W-135 Combined",,,,"Meningococcal Polysaccharide Vaccine, Groups A, C, Y and W-135 Combined, is indicated for active immunization against invasive meningococcal disease caused by these serogroups [Ref766:FDA: Menomuneâ€“ A/C/Y/W-135].","MEMOMUNE is cultivated with Mueller Hinton agar and Watson Scherp media and is freeze-dried with the group-specific polysaccharide antigens from Neisseria meningitidis, Group A, Group C, Group Y and Group W-135 [Ref766:FDA: Menomuneâ€“ A/C/Y/W-135].","",,10,Individuals with known sensitivity to thimerosal or any other component of the vaccine.
317,317,47,Subunit vaccine,"",,,,"Pneumococcal polysaccharide vaccine provides at least 85% protection in those under 55 years of age for five years or longer. Immunization is suggested for those at highest risk of infection, including those 65 years or older. The vaccine is generally given with a single lifetime dose [Ref715:Wiki: S. pneumoniae]. The most common adverse experiences reported with PNEUMOVAX 23 in clinical trials were: Local reaction at injection site including soreness, erythema, warmth, swelling and induration, and fever <102Â°F. In post-marketing experience, injection site cellulitis-like reactions were reported rarely; between 1989 and 2002, when approximately 43 million doses were distributed, the annual reporting rate was <2/100,000 doses [Ref716:Merck: PNEUMOVAX 23].","It consists of a mixture of highly purified capsular polysaccharides from the 23 most prevalent or invasive pneumococcal types of Streptococcus pneumoniae, including the six serotypes that most frequently cause invasive drug-resistant pneumococcal infections among children and adults in the United States [Ref772:FDA: PNEUMOVAX 23].","",,10,Hypersensitivity to any component of the vaccine.
318,318,47,Conjugate vaccine,"A sterile solution of saccharides of the capsular antigens of Streptococcus pneumoniae serotypes 4, 6B, 9V, 14, 18C, 19F, and 23F individually conjugated to diphtheria CRM197 protein [Ref768:FDA: Prevnar].",,,,"In the USA, a heptavalent pneumococcal conjugate vaccine vaccine (PCV 7) (e.g. Prevnar) is recommended since 2000 for all children aged 2â€“23 months and for at-risk children aged 24â€“59 months. The normally 4-doses series is given at 2, 4, 6 & 12â€“14 months of age. Protection is good against deep pneumococcal infections (especially septicemia and meningitis) [Ref715:Wiki: S. pneumoniae].","Each serotype is grown in soy peptone broth. The individual polysaccharides are purified through centrifugation, precipitation, ultrafiltration, and column chromatography.","",,10,"Hypersensitivity to any component of the vaccine, including diphtheria toxoid, is a contraindication to use of this vaccine."
319,319,11,"Inactivated or ""killed"" vaccine","Plague bacilli, killed",,,,Route Description: intramuscular,"","",,10,
320,320,48,"Inactivated or ""killed"" vaccine","Hepatitis A Vaccine, Inactivated",,,,Indication: To support lowering the age indication for Havrix from two years to 12 months of age [Ref750:FDA: Havrix].,"HAVRIX (Hepatitis A Vaccine) is a sterile suspension of inactivated virus for intramuscular administration. The virus (strain HM175) is propagated in MRC-5 human diploid cells. After removal of the cell culture medium, the cells are lysed to form a suspension. This suspension is purified through ultrafiltration and gel permeation chromatography procedures. Treatment of this lysate with formalin ensures viral inactivation. Viral antigen activity is detected by ELISA and expressed in terms of ELISA Units (EL.U.) [Ref750:FDA: Havrix].","",,10,"HAVRIX can cause a severe allergic reaction (e.g., anaphylaxis) after a previous dose of any hepatitis A-containing vaccine, or to any component of HAVRIX, including neomycin. Hepatitis A vaccine may not prevent hepatitis A infection in individuals who have an unrecognized hepatitis A infection at the time of vaccination [Ref750:FDA: Havrix]."
321,321,48,"Inactivated or ""killed"" vaccine","Hepatitis A Vaccine, Inactivated",,,,"Indication: Lowering the age indication for VAQTA from two years to 12 months of age [Ref751:FDA: VAQTA].

VAQTA is indicated for active immunization against disease caused by hepatitis A virus in persons 12 months of age and older. Primary immunization should be given at least 2 weeks prior to expected exposure to Hepatitis A Virus (HAV).","VAQTA [Hepatitis A Vaccine, Inactivated] is an inactivated whole virus vaccine derived from hepatitis A virus (HAV) grown in cell culture in human MRC-5 diploid fibroblasts. It contains inactivated virus of a strain which was originally derived by further serial passage of a proven attenuated strain. The virus is grown, harvested, purified by a combination of physical and high performance liquid chromatographic techniques developed at the Merck Research Laboratories, formalin inactivated, and then adsorbed onto amorphous aluminum hydroxyphosphate sulfate. One milliliter of the vaccine contains approximately 50 units (U) of hepatitis A virus antigen, which is purified and formulated without a preservative [Ref751:FDA: VAQTA].","",,10,Hepatitis A vaccine should not be administered to persons with a history of a severe reaction to a prior dose of hepatitis A vaccine or to a vaccine component.
322,322,49,Subunit vaccine,Hepatitis B surface antigen (HBsAg) produced in yeast cells.,,,,"","RECOMBIVAX HB is a sterile suspension for intramuscular injection. It is a non-infectious subunit viral vaccine derived from hepatitis B surface antigen (HBsAg) produced in yeast cells. A portion of the hepatitis B virus gene, coding for HBsAg, is cloned into yeast, and the vaccine for hepatitis B is produced from cultures of this recombinant yeast strain according to methods developed in the Merck Research Laboratories. The antigen is harvested and purified from fermentation cultures of a recombinant strain of the yeast Saccharomyces cerevisiae containing the gene for the adw subtype of HBsAg [Ref748:Merck: Recombivax HB].","",,10,RECOMBIVAX-HB should not be administered to anyone with a known hypersensitivity to yeast or any component of the vaccine.
323,323,49,Subunit vaccine,Hepatitis B surface antigen,,,,ENGERIX-B is a sterile suspension of noninfectious hepatitis B virus surface antigen (HBsAg) for intramuscular administration. It is manufactured by GlaxoSmithKline Biologicals. It is licensed for human use in USA [Ref761:FDA: ENGERIX-B].,"ENGERIX-B contains purified surface antigen of the virus obtained by culturing genetically engineered Saccharomyces cerevisiae cells, which carry the surface antigen gene of the hepatitis B virus. The surface antigen expressed in Saccharomyces cerevisiae cells is purified by several physicochemical steps and formulated as a suspension of the antigen adsorbed on aluminum hydroxide. Each 0.5-mL dose contains 10 mcg of hepatitis B surface antigen adsorbed on 0.25 mg aluminum as aluminum hydroxide [Ref761:FDA: ENGERIX-B].","",,10,"ENGERIX-B should not be administered to anyone with known hypersensitivity to any component of the vaccine, including yeast and any previous hypersensitivity to any hepatitis B-containing vaccine."
324,324,50,"Inactivated or ""killed"" monovalent vaccine",inactivated monovalent influenza virus H5N1,,,,"Influenza Virus Vaccine, H5N1, is an inactivated monovalent influenza virus vaccine, indicated for active immunization of persons 18 through 64 years of age at increased risk of exposure to the H5N1 influenza virus subtype.","A sterile suspension of H5N1 is prepared from an influenza virus propagated in embryonated chicken eggs which are harvested and inactivated with formaldehyde. The influenza virus is concentrated and purified in a linear sucrose density gradient solution using a continuous flow centrifuge. The virus is ""split"" and then further purified and suspended in sodium phosphate-buffered isotonic sodium chloride solution [Ref757:FDA: Sanofi Pasteur H5N1].",There were no adverse effects recorded in clinical trials of this vaccine.,,10,"H5N1 should not be administered to anyone with known systemic hypersensitivity reactions to egg proteins (eggs or egg products), to chicken proteins, or to any component of H5N1 or who has had a life-threatening reaction to previous administration of any influenza vaccine."
325,325,50,"Inactivated or ""killed"" vaccine","The vaccine is a purified, inactivated, split virion influenza vaccine made by â€œsplittingâ€ the purified, inactivated, whole virus to form fragments. This process reduces the number of adverse events experienced with whole virus vaccines, yet leaves the surface antigens and structural proteins in their original antigenic form.  This vaccine includes Influenza virus subtypes A and type B, and is specifically formulated to contain A/California/7/2009 (H1N1), A/Wisconsin/15/2009 (H3N2) and B/Brisbane/60/2008 (B Strain) [Ref755:FDA: Afluria].",,,,"","Afluria is a sterile suspension prepared from influenza virus. The virus is harvested from the allantoic fluid of embryonic chicken eggs, and purified in a sucrose density gradient using a continous flow zonal centrifuge. The purified virus is inactivated with beta propiolactone. The virus particles are disrupted using sodium taurdeoxycholate to produce a ""split virion."" The disrupted virus is further purified and suspended in a phosphate-buffered isotonic solution [Ref755:FDA: Afluria].","",,10,"AFLURIA should not administered to anyone with known hypersensitivity to eggs or chicken protein, neomycin, or polymyxin, or in anyone who has had a life-threatening reaction to previous influenza vaccination [Ref755:FDA: Afluria]."
326,326,50,"Inactivated or ""killed"" vaccine",Inactivated split-virion trivalent vaccine consisting of the FDA-recommended strains of influenza A and influenza B viruses for the 2007/2008 flu season.,,,,"","FLUARIX is a sterile suspension prepared from influenza viruses propagated in embryonated chicken eggs. Each influenza viruses is produced and purified separately. After harvesting, each influenza virus is concentrated and purified by zonal centrifugation using a linear sucrose density gradient solution containing detergent to disrupt the viruses. Following dilution, the vaccine is further purified by diafiltration. Each influenza virus solution is inactivated by the consecutive effects of sodium deoxycholate and formaldehyde leading to the production of a â€œsplit virus.â€ Each split inactivated virus is then suspended in sodium phosphate-buffered isotonic sodium chloride solution [Ref752:GSK: US Fluarix].",Most adverse events in clinical trials were mild and self-limited.,,10,"FLUARIX should not be administered to anyone with known systemic hypersensitivity reactions to egg proteins (eggs or egg products), to chicken proteins, or to any component of FLUARIX or who has had a life-threatening reaction to previous administration of any influenza vaccine [Ref752:GSK: US Fluarix]."
327,327,50,"Inactivated or ""killed"" vaccine",Inactivated influenza virus subtypes A and type B,,,,FLULAVAL is an inactivated influenza virus vaccine indicated for active immunization of adults (18 years of age and older) against influenza disease caused by influenza virus subtypes A and type B contained in the vaccine.,"FLULAVAL is a trivalent, split-virion, inactivated influenza virus vaccine prepared from virus propagated in the allantoic cavity of embryonated hensâ€™ eggs. Each of the influenza virus strains is produced and purified separately. The virus is inactivated with ultraviolet light treatment followed by formaldehyde treatment, purified by centrifugation, and disrupted with sodium deoxycholate [Ref908:FDA: FluLaval].","",,10,"FLULAVAL should not be administered to anyone with known systemic hypersensitivity reactions to egg proteins (eggs or egg products), to chicken proteins, or to any component of FLULAVAL, or who has had a life threatening reaction to previous influenza vaccination [Ref908:FDA: FluLaval]."
328,328,50,"Live, attenuated vaccine","influenza virus subtypes A and type B.  Flumist contains three strains: A/South Dakota/6/2007 (H1N1) (A/Brisbane/59/2007-like), A/Uruguay/716/2007 (H3N2) (A/Brisbane/10/2007-like), and B/Florida/4/2006 [Ref758:FDA: Flumist].",,,,This vaccine should be used for the active immunization of individuals 2-49 years of age against influenza disease.,"Eggs are inoculated with each of the strains and incubated.  The fluid of these eggs is harvested, pooled and then filtrated. The virus is ultracentrifugated and diluted with stabilizing buffer.  Ethylene diamine tetracetic acid (EDTA) is added to the dilution buffer for H3N2 strains. The viral harvests are then sterile filtered to produce the monovalent bulks. Each lot is tested for ca, ts, and att phenotypes and is also tested extensively by in vitro and in vivo methods to detect adventitious agents. Monovalent bulks from the three strains are subsequently blended and diluted as required to attain the desired potency with stabilizing buffers to produce the trivalent bulk vaccine. The bulk vaccine is then filled directly into individual sprayers for nasal administration [Ref758:FDA: Flumist].","",,10,"FLUMIST should not be administered to anyone with a known history of hypersensitivity, especially anaphylactic reactions, to eggs, egg proteins, gentamicin, gelatin, or arginine or with life-threatening reactions to previous influenza vaccinations. FLUMIST also is contraindicated in children and adolescents (2-17 years of age) receiving aspirin therapy or aspirin-containing therapy, because of the association of Reyeâ€™s syndrome with aspirin and wild-type influenza infection [Ref758:FDA: Flumist].

FLUMIST should also not be administered to anyone with asthma. FLUMIST should not be given to children who use a bronchodilator or steroids."
329,329,50,"Inactivated or ""killed"" vaccine",Influenza virus subtypes A and type B,,,,"","FLUVIRIN is a trivalent, sub-unit influenza virus vaccine prepared from virus propagated in hensâ€™ eggs inoculated with a specific type of influenza virus suspension containing neomycin and polymyxin. Each of the influenza virus strains is harvested and clarified by filtration prior to inactivation.  The inactivated virus is concentrated and purified by zonal centrifugation. Shake the syringe vigorously before administering the vaccine and shake the multidose vial preparation each time before withdrawing a dose of vaccine [Ref759:FDA: Fluvirin].","",,10,"FLUVIRIN should not be administered to anyone under 4 years of age or to anyone with a known history of systemic hypersensitivity reactions to egg proteins, or any other component of FLUVIRIN, or life-threatening reactions to previous influenza vaccinations."
330,330,50,"Inactivated or ""killed"" vaccine",Influenza virus subtypes A and type B,,,Eggs,Fluzone is a vaccine indicated for active immunization in persons 6 months of age and older against influenza disease caused by influenza virus subtypes A and type B contained in the vaccine.,"Fluzone vaccine (Influenza Virus Vaccine) is prepared from influenza viruses propagated in embryonated chicken eggs. The virus-containing allantoic fluid is harvested and inactivated with formaldehyde. Influenza virus is concentrated and purified in a linear sucrose density gradient solution using a continuous flow centrifuge. The virus is then chemically disrupted using a non-ionic surfactant, polyethylene glycol p-isooctylphenyl ether, (Triton X-100) producing a â€œsplit virusâ€. The split virus is further purified and then suspended in sodium phosphate-buffered isotonic sodium chloride solution.
Ref: http://www.fda.gov/cber/label/fluzoneLB.pdf",Most adverse events in clinical trials were mild and self-limited.,,10,"FLUZONE should not be administered to anyone with known severe hypersensitivity to egg proteins or any component of the vaccine or life-threatening reactions after previous administration of any influenza vaccine. Allergic reactions include hives, angioedema, allergic asthma, and systemic anaphylaxis [Ref756:FDA: Fluzone]."
331,331,51,"Inactivated or ""killed"" vaccine",Inactivated Japanese encephalitis (JE) virus â€œNakayama-NIHâ€ strain,,,,"JE-VAX is a sterile, lyophilized vaccine for subcutaneous use Ref747:FDA: Jevax].","JE-VAX is prepared by inoculating mice intracerebrally with Japanese encephalitis (JE) virus, â€œNakayama-NIHâ€ strain. Infected brains are harvested and homogenized in PBS, pH 8.0. The homogenate is centrifuged and the supernatant inactivated with formaldehyde, then processed to yield a partially purified, inactivated virus suspension. This is further purified by ultra-centrifugation through 40% w/v sucrose. The suspension is then lyophilized. Thimerosal (mercury derivative) is added as a preservative to a final concentration of 0.007%. The diluent sterile water for Injection contains no preservative. Each 1.0 mL dose contains approximately 500 Î¼g of gelatin, less than 100 Î¼g of formaldehyde, less than 0.0007% v/v Polysorbate 80, and less than 50 ng of mouse serum protein. No myelin basic protein can be detected at the detection threshold of the assay (<2 ng/mL). Prior to reconstitution, the vaccine is a white caked powder. After reconstitution, the vaccine is a colorless transparent liquid [Ref747:FDA: JE-Vax].","",,10,Adverse reactions to a prior dose of JE vaccine manifesting as generalized urticaria and angioedema and should not be administered to persons with a proven or suspected hypersensitivity to proteins of rodent or neural origin. [Ref747:FDA: JE-Vax].
332,332,45,"Live, attenuated vaccine","",,,,"","","",,11,
333,333,45,"Live, attenuated vaccine","",,,,"","","",,10,
334,334,45,"Live, attenuated vaccine","",,,,"","","",,10,
335,335,52,"Live, attenuated vaccine",A more attenuated line of measles virus derived from Enders' attenuated Edmonston strain,,,,ATTENUVAX is a live virus vaccine for vaccination against measles (rubeola).,ATTENUVAX is a sterile lyophilized preparation of a more attenuated line of measles virus derived from Enders' attenuated Edmonston strain and propagated in chick embryo cell culture [Ref722:FDA: Attenuvax].,"",,10,"Hypersensitivity to any component of the vaccine, including gelatin, ATTENUVAX should not be administered to persons with a history of anaphylactic, anaphylactoid or other immediate reactions (e.g., hives, swelling of the mouth and throat, difficulty breathing, hypotension and shock) subsequent to egg ingestion."
