"c_vaccine_detail_id","c_vaccine_id","c_pathogen_id","c_type","c_antigen","c_model_host","c_vector","c_allergen","c_description","c_preparation","c_virulence","c_full_text","c_curation_flag","c_contraindication"
136,136,8,Attenuated live vaccine,"",,"",,"Vaccination with the rough strain VTRS1 induces protection against virulent strains of B. abortus (2308), B melitensis (16M), B. suis biovar 1 (750), B. suis biovar 4 (2579)   [Ref216:Winter et al., 1996].","The rough mutant VTRS1 was obtained from B. suis 2579 by allelic exchange of the rfbU gene encoding mannosyltransferase with a Tn5-disrupted rfbU gene  [Ref216:Winter et al., 1996].","VTRS1, like RB51, is a stable rough form of the bacterium.  It does not manifest evidence of reversion during passage in mice  [Ref216:Winter et al., 1996].",,10,
137,137,8,subunit vaccine,B. melitensis strain 16M lipopolysaccharide (LPS),,"",,"LPS, an outer membrane endotoxin common to gram negative bacteria, consists of three parts: Lipid A, a core oligosaccharide, and an O-antigen.  The O-antigen is found in smooth strains only.","The LPS was extracted from killed cells and purified by a modification of the method of Bundle et al  [Ref219:Bhattacharjee et al., 2006].",None.,,10,
138,138,8,DNA vaccine,"B. abortus Cu/Zn Superoxide dismutase [Ref220:Munoz-Montesino et al., 2004].",,"",,"Cu-Zn superoxide dismutase (SOD) is one of the protective immunogens of Brucella abortus. Intramuscular injection with a plasmid DNA carrying the SOD gene (pcDNA-SOD) was able to induce a protective immune response in mice  [Ref220:Munoz-Montesino et al., 2004].","Recombinant plasmid pBAII-3, containing the gene for B. abortus Cu-Zn SOD (sodC), and its own promoter, was initially obtained from a pUC9 genomic library of B. abortus strain 2308. A 1.1-kb fragment containing the sodC gene and its promoter sequences was excised and ligated into the expression vector pcDNA3 downstream of the cytomegalovirus promoter. The resulting plasmid was designated pcDNA-SOD. A colony of E. coli containing pcDNASOD was cultured and used for large-scale plasmid DNA isolation. The DNA was resuspended in PBS at a final concentration of 1 mg/ml. The pcDNA-SOD plasmid construct was verified by restriction digestion and by sequencing of the complete insert [Ref220:Munoz-Montesino et al., 2004].","",,10,
139,139,8,DNA vaccine,"Brucella outer membrane protein and lumazine synthase from Brucella spp. (BLS) [Ref222:Cassataro et al., 2007].",,"",,"Brucella outer membrane protein and lumazine synthase from Brucella spp. (BLS) induce protection against Brucella spp.  A novel mode of delivering these antigens was devised as a DNA vaccine  [Ref222:Cassataro et al., 2007].","To develop the chimerical plasmid, the BLSOmp31 DNA sequence was amplified by PCR using pETBLSOmp31 as template and sub-cloned in the pCI-neo vector (Promega, Madison, WI). The following oligonucleotides were constructed including restriction sites at the 5",None.,,10,
140,140,27,Subunit protein vaccine,"",,"",,"Dobrava hantavirus (DOBV) causes a severe form of hemorrhagic fever with renal syndrome (HFRS). Currently there is no therapy or vaccine available for HFRS [Ref229:Klingstrom et al., 2004]. ","Recombinant DOBV nucleocapsid protein (rDOBV N) given with Alum or Freund's as adjuvant [Ref229:Klingstrom et al., 2004].",Not virulent,,10,
141,141,27,Subunit protein vaccine,"",,"",,"","DOBV RNA (strain DOB-90/5) was extracted from infected Vero E6 cells (CRL 1586; ATCC, USA). The genomic RNA of DOBV was reverse-transcribed and PCR amplified in order to generate the entire S-segment, using following oligonucleotide primers: 5'-GCGAATTCGCAACACTAGAGGAACTCCAAAAGG-3' and 5'-CGAAGCTTAGTGGTGGTGGTGGTGGTGAAGTTTGAGCGGCTCC-3'. The amino-terminal part encoding the first 118 amino acids was generated using 5'-CTGGCGCCTAACCGACGTGGTGGTGGTGGTGGTGATTCGAAGC-3' as reverse primer. In all constructs, a histidine (His) tag was introduced at the C-terminal end. PCR fragments were cloned in plasmids pTEX(rP40) or pTEXmp18 respectively with or without the inclusion of the P40 sequence in the construct. Following transformation of the E. coli ICONE 200 strain, the recombinant proteins were produced as intracellular inclusion bodies, recovered, and renatured. The recombinant proteins were purifi ed by metal chelate affinity chromatography using a HisTrap kit (Pharmacia, Puurs, Belgium). Using this protocol, four DOBV rNp constructs were expressed and purified. The complete nucleocapsid protein of DOBV was expressed with or without the addition of the rP40 protein (constructs P40-Dob-N and Dob-N). The amino-terminal part of the DOBV nucleocapsid protein was expressed with the addition of the rP40 protein (construct P40-Dob118) or with the addition of only the periplasmic part of the rP40 protein (construct P40p-Dob118) [Ref231:Maes et al., 2006].",Not virulent,,10,
142,142,25,Protein subunit,"E. coli Intimin and Efa-1 polypeptides [Ref208:van et al., 2007].",,"",,"Enterohaemorrhagic Escherichia coli (EHEC) are zoonotic enteric pathogens of worldwide importance. EHEC strains produce intimin, an outer membrane adhesin encoded by the eae gene located in a chromosomal pathogenicity island termed the locus of enterocyte effacement. Intimin mediates intimate bacterial attachment to enterocytes by binding to Tir, a bacterial protein which is translocated into host cells by a LEE-encoded type III secretion system. Intimin can also bind in vitro to Î²1-integrins and cell-surface localised nucleolin and these proteins can be detected proximal to adherent EHEC O157:H7 in vivo. Intimin is a key colonisation factor for EHEC O157:H7 in neonatal calves, young and weaned calves and adult cattle and sheep. In addition, intimin influences the carriage and virulence of EHEC O157:H7 in streptomycin pre-treated mice, infant rabbits and gnotobiotic and neonatal piglets. Another factor influencing colonisation of the bovine intestines is EHEC factor for adherence (Efa-1). Non-O157 EHEC, including serotype O26:H-, contain a full-length copy of efa-1 while EHEC O157:H7 contains a truncated form which is predicted to encode the amino-terminal 433 amino acids of the protein (efa-1â€²). Mutation of efa-1 in EHEC serotypes O5:H- and O111:H- significantly reduced faecal excretion and bacterial adherence to the colonic epithelium in experimentally infected calves. Antibodies directed against the central and carboxyl-terminal portions of Efa-1 label the bacterial surface and inhibit adherence of rabbit enteropathogenic E. coli (EPEC) to cultured epithelial cells and this may indicate that Efa-1 is an adhesin. However, efa-1 mutations in EHEC O5:H- and O111:H- indirectly impair the expression and secretion of type III secreted proteins encoded by the LEE that are known to influence intestinal colonisation. Mutation of the truncated efa-1 gene of EHEC O157:H7 impaired adherence to cultured cells but did not significantly impair intestinal colonisation of calves [Ref208:van et al., 2007].","Proteins were expressed in E. coli K-12 strain BL21 (DE3) Star cells which lack RNaseE to stabilise mRNA. The Overnight Expressâ„¢ Autoinduction System I (NovagenÂ®) was used to induce Int280-Î³ and Int280-Î² expression. Cell extracts were prepared using BugBusterÂ® (NovagenÂ®) and the supernatant fraction mixed with His-Magâ„¢ Agarose Beads (NovagenÂ®) for affinity purification of the Int280 proteins as described by the manufacturer. Efa-1 proteins were expressed under IPTG induction in E. coli BL21 (DE3) Star and the proteins purified by affinity chromatography using HIS-Selectâ„¢ Nickel Affinity Gel (Sigma, St. Louis, MO, USA) under denaturing conditions [Ref208:van et al., 2007].",Not noted.,,11,
143,143,29,Attenuated live vaccine,"",,"",,"Albert Calmette and Camille Guerin, two French scientists, made an attenuated strain from another mycobacterium (M. bovis) by growing it for 13 years on culture. They observed a reduction in the virulence in animals through this period. When infants were given this vaccine, it provided a reduction in mortality by 90%. Since then, Bacille Calmette Guerin [BCG] has become the most widely used vaccine throughout the world. It is estimated that more than 3 billion people have received BCG. The protective efficacy of BCG vaccine against adult pulmonary TB has varied dramatically from 80 to 0% [Ref233:Gupta et al., 2007]. 

Development of the BCG strain was predated by numerous M. tuberculosis studies from the 1890s-1920s, including (Lote 1889, Strauss 1895, Moriya 1909, Romer 1903, Weber 1912, Binder 1915, and Browning and Gulbransen 1926) in a diverse set of hosts (including mouse, avian, human, bovine, and guinea pig hosts) [Ref548:SWEDBERG, 1951].  

Several new subunit booster vaccinations are under development, including Ag85, Mtb72F, HspX and other DosR-controlled gene products, Rv3407 and other Rpf-controlled gene products, and heparin-binding hemagglutinin (HBHA) [Ref401:Kaufmann, 2005].","The evaluation of BCG lacks comparability among the vaccination studies due to the use of six different BCG sub-strains [Copenhagen-1331, Pasteur-1173P, Glaxo-1077, Tokyo-172, Russian, Moreau]. The comparative genomic analysis of different BCG strains has shown that there is no uniformity among all presently used vaccines and this genetic variability may contribute to the variation in protective efficacy seen in different geographic regions of the world [Ref233:Gupta et al., 2007].

In one case, Calmette et al. (1923) used decreasing doses (1 mg, .01 mg, and .002 mg) of tubercle bacilli to infect guinea pigs s.c.  Bacterial loads increased in response to decreasing dose sizes.  Similar results were acquired for later intramuscular and intracerebral infection procedures by other groups [Ref548:SWEDBERG, 1951]","The original BCG strain lost its virulence after 39 passages by Albert Calmette and Camille Guerin, and was administered to humans i.d. on the 231st passage.  The BCG bacteria showed altered colony morphologies and no virulence in experimental animals.   BCG has shown a high degree of safety over the years  [Ref550:Ducati et al., 2006].  

--Calmette et al. used length of survival as a metric for virulence in their 1923 study [Ref356:Agger et al., 2002].  
--The increased ability for M. bovis strains to retain virulence was noted by Lange in 1922 [Ref548:SWEDBERG, 1951]. ",,10,
144,144,26,Conjugate vaccine,"HIV Gag protein together with Env protein [Ref313:Chen et al., 2005]",,"",,"Live-vector-based HIV (LVB-HIV) vaccines are an integral part of a number of vaccine regimens currently under evaluation. Live vectors that carry an intact gag gene are capable of eliciting HIV pseudovirion particle formation from infected host cells. The impact of pseudovirion particle formation on the immune response generated by live HIV vaccine vectors has not been established [Ref313:Chen et al., 2005].","In this study, a canarypox HIV vaccine candidate vector expressing HIV gag and env genes, vCP205, was modified by the introduction of a glycine-to-alanine coding change in the N-terminal myristylation site of gag to create Myr- vCP205. This substitution effectively eliminated particle formation without altering the level of protein production [Ref313:Chen et al., 2005].","HIV Gag protein drives the process of particle assembly and is sufficient to generate the production of pseudovirions. Thus, live vectors that include a complete gag gene and elicit sufficient production of Gag protein in the
cytoplasm of infected cells will generate pseudovirions. Pseudovirion production has been demonstrated to occur in tissue culture cells infected by viral vectors expressing Gag proteins. Expression of Gag together with the
envelope protein (Env) by live vaccine vectors leads to the release of pseudovirions bearing Env on their surfaces [Ref313:Chen et al., 2005].",,11,
145,145,26,DNA vaccine priming and Ad vector vaccine boosting,"SIVmac239 gag protein [Ref263:Shiver et al., 2002]",,DNA plasmid and adenoviral vector (Ad5),,"Immunization and viral challenge studies were conducted in rhesus macaques (Macaca mulatta). Each of the test vectors expressed the identical SIVmac239 gag gene that had been codon optimized for expression in mammalian cells. The plasmid DNA vector was formulated in either PBS solution, a solution containing adjuvant, or a solution containing MPL/alum. All immunized animals were genotyped for the MHC class I Mamu-A*01 allele, allowing analysis of the responses of T cells (CD8+) to the test vaccines [Ref263:Shiver et al., 2002].","The V1R DNA vector expressed the identical SIVmac239 gag gene that had been codon optimized for expression in mammalian cells [Ref263:Shiver et al., 2002]. The plasmid DNA vector was formulated in a solution containing a nonionic blocked copolymer adjuvant (CRL1005) [Ref263:Shiver et al., 2002].
The adenoviral vector was based on a serotype 5 adenovirus that is incompetent to replicate with deletion of the E1 and E3 viral genes, and was propagated subsequently in E1-expressing 293 cells. Recombinant adenovirus expressing the codon-optimized SIV gag gene was then prepared. The recombinant adenovirus (Ad5-SIVgag) was grown in large quantities by multiple rounds of amplification in 293 cells. The virus was purified by caesium chloride gradient centrifugation [Ref263:Shiver et al., 2002].","No virulence has been reported associated with this vaccine [Ref263:Shiver et al., 2002].",,10,
146,146,26,DNA vaccine priming and Ad5/35 vaccine boosting,"HIV Env gp160 protein [Ref317:Xin et al., 2005]",,DNA plasmid and a replication-defective chimeric Ad5 vector with the Ad35 fiber (Ad5/35),,"Replication-defective Ad5 HIV recombinants and replication-defective MVA elicit potent CD8+ T-cell responses and provide a high degree of protection in NHPs. The Ad5 (subgroup C) has well-defined biological properties and has been widely used as a vector for gene therapy and vaccine. The replication-defective Ad5 vector can easily be produced in high titers and is highly effective in boosting HIV-specific immunity. However, this virus uses CAR as its primary attachment receptor, which confers tropism for liver parenchymal cells. This raises important safety concerns. Thus, a replication-defective chimeric Ad5 vector with Ad type 35 fiber (Ad5/35) has been developed, which not only induces strong antigen-specific humoral and cellular immune responses and exhibits minimal hepatotoxicity in both mice and NHPs, but is also significantly less susceptible to the pre-existing Ad5 immunity than a comparable Ad5 vector [Ref317:Xin et al., 2005].","A replication-defective chimeric Ad5 vector with the Ad35 fiber (Ad5/35) was prepared and used to express HIV Env gp160 protein. The product is named Ad5/35-HIV [Ref317:Xin et al., 2005].","This novel Ad5/35 vector showed minimal hepatotoxicity after intramuscular administration with the novel Ad5/35 vector [Ref317:Xin et al., 2005].",,10,
147,147,26,"","HIV lipopeptides and canarypox [Ref314:Durier et al., 2006]",,"",,"HIV-1 lipopeptides have been developed by the French National Agency for AIDS Research (ANRS) for use as candidate vaccine against HIV since 1994. Between 1996 and 2005, four different lipopeptide constructs were tested alone or in combination with recombinant canarypox HIV vaccines in 10 trials conducted in France [Ref314:Durier et al., 2006].","Four different lipopeptide constructs given with or without an immunological adjuvant (QS-21) and different diluents were tested alone or in combination with recombinant canarypox HIV vaccines [Ref314:Durier et al., 2006].","Local reactions were common. However, in trials where lipopeptides were tested without adjuvant and appropriate diluents, none of the vaccinees experienced severe local response. Systemic reactions were generally mild and transient. No grade 4 reaction was reported; 18 subjects experienced grade 3 systemic events related to the vaccination, mainly asthenia, fever, headache and arthralgia. Multivariate analysis showed that female sex, number of injections and diluent significantly increased systemic reactions related to the vaccination. These data demonstrate that reactogenicity and systemic safety of HIV lipopeptides vaccine are acceptable both in healthy volunteers and HIV-infected adults [Ref314:Durier et al., 2006].",,11,
148,148,26,DNA vaccine,"HIV-1 viral protein R (Vpr) is a virion-associated gene product that profoundly affects T cell proliferation, induces apoptosis, and can affect cytokine production through interfering with NF-{kappa}B-mediated transcription from host cells [Ref320:Ayyavoo et al., 2002].",,"",,"Collectively, these effects support that Vpr could influence immune activation in vivo. However, this effect of Vpr has not been explored previously. Vpr co-vaccination significantly altered the immune response to co-delivered antigen. Specifically, in the presence of Vpr, inflammation was markedly reduced compared to antigen alone. Vpr reduced antigen-specific CD8-mediated cytotoxic T lymphocyte activity and suppressed Th1 immune responses in vivo as evidenced by lower levels of IFN-{gamma}. In the presence of Vpr, there is a profound shift in isotype towards a Th2 response as determined by the IgG2a:IgG1 ratio. The data support that Vpr compromises antigen-specific immune responses and ultimately effector cell function, thus confirming a strong selective advantage to the virus at the expense of the host [Ref320:Ayyavoo et al., 2002].","Here the effect of Vpr expression in an in vivo model system on the induction of antigen-specific immune responses was examined using a DNA vaccine model [Ref320:Ayyavoo et al., 2002].","Vpr co-vaccination significantly altered the immune response to co-delivered antigen. In the presence of Vpr, inflammation was markedly reduced compared to antigen alone. In the presence of Vpr, there is a profound shift in isotype towards a Th2 response as determined by the IgG2a:IgG1 ratio. The data support that Vpr compromises antigen-specific immune responses and ultimately effector cell function, thus confirming a strong selective advantage to the virus at the expense of the host [Ref320:Ayyavoo et al., 2002].",,11,
149,149,26,DNA vaccine,"The antigens are named MultiHIV-A (based on the subtype A consensus sequence), MultiHIV-B (subtype B consensus sequence), MultiHIV-C, and MultiHIV-FGH (based on ancestral sequence for subtypes F, G, and H). The MultiHIV DNAs encode polypeptides consisting of a fusion of the full-length regulatory proteins Rev, Nef and Tat as well structural proteins p17 and p24 [Ref319:Malm et al., 2005].",,"",,"A significant limitation for HIV vaccine development is that there are no small animals in which actual productive HIV-1 infection can be established. DNA immunization with candidate vaccines comprising multiple genes of clades A, B, C, F, G, and H create strong cellular responses in BALB/c mice, especially after gene gun immunization [Ref319:Malm et al., 2005].","A vaccine platform was constructed with an HIV-1 subtype B DNA immunogen expressing full-length consensus sequences from HIV-1 rev, nef, tat, and gag with additional cellular epitope clusters from the env and pol regions. Furthermore, this platform has been extended to three additional plasmids expressing the same immunogens but originating from subtypes A or C consensus or FGH ancestral sequences [Ref319:Malm et al., 2005].","",,10,
445,445,8,Subunit vaccine,"The antigen for this vaccine is SurA protein from B. abortus strain 2308, B. abortus strain S19, and Brucella melitensis strain H38 [Ref687:Delpino et al., 2007].",,"",,"","The PCR primers for cloning SurA gene from B. abortus were as follows: sense 5â€²AGAAAGCATATGTTTGCAAGACCTCTT3â€² (NdeI) and antisense 5â€²TCTTCGGGATCCTCAACGATTGACGATGGT3â€² (BamHI). B. abortus genomic DNA was used as template for PCR with Pfu DNA polymerase (Stratagene). The surA gene was cloned to plasmid Pet17b and then transformed to E. coli JM19 and then BL21(DE3) competent cells. Recombinant proteins were adsorbed with Sepharose-polymyxin B (Sigma, St. Louis, MO) to eliminate lipopolysaccharide contamination [Ref687:Delpino et al., 2007].","",,10,""
150,150,26,DNA vaccine,"HIV Gag and Env [Ref321:Otten et al., 2005]",,"",,"PLG microparticles are an effective means of delivering DNA vaccines in nonhuman primates, as demonstrated for two different types of DNA vaccines encoding two different antigens, and are compatible for use with DNA prime-protein boost regimens [Ref321:Otten et al., 2005].","Three technologies were employed here for increasing the potency of DNA vaccines in rhesus macaques include DNA encoding Sindbis virus RNA replicons (pSINCP), cationic poly(lactide-co-glycolide) (PLG) microparticles for DNA delivery, and recombinant protein boosting [Ref321:Otten et al., 2005].","The DNA-based pSINCP replicon vaccines encoding HIV Gag and Env were approximately equal in potency to human cytomegalovirus (CMV) promoter-driven conventional DNA vaccines (pCMV) [Ref321:Otten et al., 2005].",,11,
151,151,26,"","anthrax lethal factor, HIV gag protein [Ref315:McEvers et al., 2005][Ref316:Lu et al., 2000]",,"",,"Both CD4+ and CD8+ T cells are essential components of the CMI response to HIV. Although vaccine development commonly focuses on eliciting robust virus-specific CD8+ T cell responses, CD4+ T cells play an important role in establishing protection and controlling disease in chronic HIV infection. CD4+ T helper cells are essential for the establishment of productive CTL and antibody responses, while CD8+ cytotoxic T cells kill virus-infected cells. An antigen carrier construct able to efficiently induce both CD4+ and CD8+ T cell responses represents an attractive HIV vaccine candidate. It has previously been shown that LFnâ€“HIV fusion proteins elicit HIV-specific cytolytic responses [Ref315:McEvers et al., 2005]. Constructs encoding gag p24 and nef stimulate gag-specific CD4 proliferation and a secondary CTL response in HIV-infected donor peripheral blood mononuclear cells in vitro [Ref316:Lu et al., 2000].","The LFnâ€“HIV constructs are synthesized by PCR and cloned into the pET15LFn plasmid. Fusion proteins were produced and characterized by SDS-PAGE with Western blot analysis using monoclonal anti-HIV antibody. Purification of the His-tagged proteins was conducted using a commercial kit [Ref315:McEvers et al., 2005]. In a separate experiment, the DNA fragment encoding the V3 region and gag p24 from HIV-HXB were amplified by PCR, cloned into the LFn expression plasmid pET15bLFn, and sequenced to verify the inframe fusion between the LFn and the HIV coding sequence. Recombinant LFn is expressed in E. coli as an intracellular soluble protein with 6 tandem histidine residues at its N-terminal end. Purification of the His-tagged proteins was conducted by using a commercial kit according to the manufacturer's protocol [Ref316:Lu et al., 2000].","LFnâ€“HIV constructs are non-toxic and their lyophilized form is stable and soluble, therefore facilitating wide and efficient distribution [Ref315:McEvers et al., 2005].",,11,
152,152,26,DNA/MVA prime-boost vaccine,HIV-1 clade A gag p24/p17 consensus sequence,,"",,"","An HIVA.DNA/modified vaccinia Ankara (MVA) prime-boost vaccine is being developed for the potential prevention of infection with HIV subtype A. The vaccination strategy consists of priming with a DNA vaccine made from HIV-1 clade A gag p24/p17 consensus sequence (pTHr.HIVA) then boosting with a MVA virus expressing HIVA (MVA.HIVA) [Ref318:Kent et al., 2007].","",,10,
153,153,26,Recombinant vector vaccine,"HIV Gag, Pol, and Env proteins [Ref323:Liu et al., 2006]",,modified vaccinia Ankara (MVA),,"","An rMVA vaccine that expresses HIV Gag, Pol, and Env proteins was constructed [Ref323:Liu et al., 2006].","",,10,
448,448,8,"Live, attenuated vaccine","",,"",,"","A B. melitensis vaccine that is recombinant B. melitensis Rev. 1 vaccine with the p39 gene deletion [Ref877:Tibor et al., 1998].","",,10,""
449,449,8,"Live, attenuated vaccine","",,"",,"","A B. abortus vaccine that is recombinant B. abortus strain 19vaccine with the p39 gene deletion [Ref877:Tibor et al., 1998].","",,10,""
154,154,26,DNA vaccine priming and fowlpox vaccine boosting,"SHIV89.6P env and SIVmac239 gag [Ref322:Santra et al., 2004]",,DNA plasmid and recombinant fowlpox virus,,"An HIV vaccine should elicit a cytotoxic T lymphocyte (CTL) response, but the characteristics of effective vaccine-induced CTL response remain unclear. The SHIV/rhesus monkey model has been used to in the course of assessing the relative immunogenicity of vaccine regimens that include a cytokine-augmented plasmid DNA prime and a boost with DNA or recombinant pox vectors. This study indicates that the steady-state memory, rather than the peak effector vaccine-elicited CTL responses, may be the critical immune correlate of protection for a CTL-based HIV vaccine [Ref322:Santra et al., 2004].","The recombinant vaccinia viruses (rVac) expressing SHIV89.6P env and SIVmac239 gag were constructed by inserting these genes in the HindIII M region of TBC-Wy, Therion strain of vaccinia. rFPV viruses expressing these same genes were constructed by inserting the genes in the BamJHI region of POXVAC-TC (Schering-Plough) strain of FPV [Ref322:Santra et al., 2004].","",,10,
